A1: 第六次科学暑假作业提交
A2: 姓名 | B2: 未订正 | C2: 未交/不合格 | D2: 积分
A3: 周吴恺 | B3: =COUNTIF(Sheet1!I:I,A3) -> 1 | C3: =COUNTIF(Sheet1!J:J,A3) -> 0 | D3: =25-B3*10-C3*25 -> 15
A4: 徐晨浩 | B4: =COUNTIF(Sheet1!I:I,A4) -> 0 | C4: =COUNTIF(Sheet1!J:J,A4) -> 0 | D4: =25-B11*10-C11*25 -> 25
A5: 施轩哲 | B5: =COUNTIF(Sheet1!I:I,A5) -> 0 | C5: =COUNTIF(Sheet1!J:J,A5) -> 1 | D5: =25-B5*10-C5*25 -> 0
A6: 方汉文 | B6: =COUNTIF(Sheet1!I:I,A6) -> 0 | C6: =COUNTIF(Sheet1!J:J,A6) -> 1 | D6: =25-B6*10-C6*25 -> 0
A7: 王琳琳 | B7: =COUNTIF(Sheet1!I:I,A7) -> 0 | C7: =COUNTIF(Sheet1!J:J,A7) -> 1 | D7: =25-B7*10-C7*25 -> 0
A8: 柳硕 | B8: =COUNTIF(Sheet1!I:I,A8) -> 1 | C8: =COUNTIF(Sheet1!J:J,A8) -> 0 | D8: =25-B8*10-C8*25 -> 15
A9: 李驿欣 | B9: =COUNTIF(Sheet1!I:I,A9) -> 0 | C9: =COUNTIF(Sheet1!J:J,A9) -> 1 | D9: =25-B9*10-C9*25 -> 0
A10: 李昭璞 | B10: =COUNTIF(Sheet1!I:I,A10) -> 0 | C10: =COUNTIF(Sheet1!J:J,A10) -> 0 | D10: =25-B10*10-C10*25 -> 25
A11: 唐钟凯 | B11: =COUNTIF(Sheet1!I:I,A11) -> 0 | C11: =COUNTIF(Sheet1!J:J,A11) -> 0 | D11: =25-B11*10-C11*25 -> 25
A12: 丁梦涵 | B12: =COUNTIF(Sheet1!I:I,A12) -> 0 | C12: =COUNTIF(Sheet1!J:J,A12) -> 1 | D12: =25-B12*10-C12*25 -> 0
A13: 蒋依琳 | B13: =COUNTIF(Sheet1!I:I,A13) -> 0 | C13: =COUNTIF(Sheet1!J:J,A13) -> 0 | D13: =25-B13*10-C13*25 -> 25
A14: 张宏博 | B14: =COUNTIF(Sheet1!I:I,A14) -> 0 | C14: =COUNTIF(Sheet1!J:J,A14) -> 0 | D14: =25-B14*10-C14*25 -> 25
A15: 缪奕成 | B15: =COUNTIF(Sheet1!I:I,A15) -> 0 | C15: =COUNTIF(Sheet1!J:J,A15) -> 1 | D15: =25-B15*10-C15*25 -> 0
A16: 朱昊清 | B16: =COUNTIF(Sheet1!I:I,A16) -> 0 | C16: =COUNTIF(Sheet1!J:J,A16) -> 1 | D16: =25-B16*10-C16*25 -> 0
A17: 徐彬 | B17: =COUNTIF(Sheet1!I:I,A17) -> 0 | C17: =COUNTIF(Sheet1!J:J,A17) -> 1 | D17: =25-B17*10-C17*25 -> 0
A18: 冯睿琦 | B18: =COUNTIF(Sheet1!I:I,A18) -> 0 | C18: =COUNTIF(Sheet1!J:J,A18) -> 1 | D18: =25-B18*10-C18*25 -> 0
A19: 张璟涵 | B19: =COUNTIF(Sheet1!I:I,A19) -> 0 | C19: =COUNTIF(Sheet1!J:J,A19) -> 1 | D19: =25-B19*10-C19*25 -> 0
A20: 汤梓潇 | B20: =COUNTIF(Sheet1!I:I,A20) -> 1 | C20: =COUNTIF(Sheet1!J:J,A20) -> 0 | D20: =25-B20*10-C20*25 -> 15
A21: 张墨轩 | B21: =COUNTIF(Sheet1!I:I,A21) -> 1 | C21: =COUNTIF(Sheet1!J:J,A21) -> 0 | D21: =25-B21*10-C21*25 -> 15
A22: 刘易 | B22: =COUNTIF(Sheet1!I:I,A22) -> 1 | C22: =COUNTIF(Sheet1!J:J,A22) -> 0 | D22: =25-B22*10-C22*25 -> 15
A23: 钟雪阳 | B23: =COUNTIF(Sheet1!I:I,A23) -> 0 | C23: =COUNTIF(Sheet1!J:J,A23) -> 1 | D23: =25-B23*10-C23*25 -> 0
A24: 陈郑好 | B24: =COUNTIF(Sheet1!I:I,A24) -> 1 | C24: =COUNTIF(Sheet1!J:J,A24) -> 0 | D24: =25-B24*10-C24*25 -> 15
A25: 陈天乐 | B25: =COUNTIF(Sheet1!I:I,A25) -> 0 | C25: =COUNTIF(Sheet1!J:J,A25) -> 1 | D25: =25-B25*10-C25*25 -> 0
A26: 郑凯睿 | B26: =COUNTIF(Sheet1!I:I,A26) -> 0 | C26: =COUNTIF(Sheet1!J:J,A26) -> 1 | D26: =25-B26*10-C26*25 -> 0
A27: 郭思哲 | B27: =COUNTIF(Sheet1!I:I,A27) -> 0 | C27: =COUNTIF(Sheet1!J:J,A27) -> 1 | D27: =25-B27*10-C27*25 -> 0
A28: 俞松凯 | B28: =COUNTIF(Sheet1!I:I,A28) -> 0 | C28: =COUNTIF(Sheet1!J:J,A28) -> 0 | D28: =25-B28*10-C28*25 -> 25
A29: 单逸凡 | B29: =COUNTIF(Sheet1!I:I,A29) -> 1 | C29: =COUNTIF(Sheet1!J:J,A29) -> 0 | D29: =25-B29*10-C29*25 -> 15
A30: 方树硕 | B30: =COUNTIF(Sheet1!I:I,A30) -> 1 | C30: =COUNTIF(Sheet1!J:J,A30) -> 0 | D30: =25-B30*10-C30*25 -> 15
A31: 武孟奕辰 | B31: =COUNTIF(Sheet1!I:I,A31) -> 0 | C31: =COUNTIF(Sheet1!J:J,A31) -> 0 | D31: =25-B31*10-C31*25 -> 25
A32: 徐熠萱 | B32: =COUNTIF(Sheet1!I:I,A32) -> 0 | C32: =COUNTIF(Sheet1!J:J,A32) -> 0 | D32: =25-B32*10-C32*25 -> 25
A33: 沈宇凡 | B33: =COUNTIF(Sheet1!I:I,A33) -> 0 | C33: =COUNTIF(Sheet1!J:J,A33) -> 0 | D33: =25-B33*10-C33*25 -> 25
A34: 付羽彤 | B34: =COUNTIF(Sheet1!I:I,A34) -> 0 | C34: =COUNTIF(Sheet1!J:J,A34) -> 1 | D34: =25-B34*10-C34*25 -> 0
A35: 徐辰羿 | B35: =COUNTIF(Sheet1!I:I,A35) -> 1 | C35: =COUNTIF(Sheet1!J:J,A35) -> 0 | D35: =25-B35*10-C35*25 -> 15
A36: 许梓琰 | B36: =COUNTIF(Sheet1!I:I,A36) -> 0 | C36: =COUNTIF(Sheet1!J:J,A36) -> 1 | D36: =25-B36*10-C36*25 -> 0
A37: 宋泽华 | B37: =COUNTIF(Sheet1!I:I,A37) -> 1 | C37: =COUNTIF(Sheet1!J:J,A37) -> 0 | D37: =25-B37*10-C37*25 -> 15
A38: 郭乐盛 | B38: =COUNTIF(Sheet1!I:I,A38) -> 0 | C38: =COUNTIF(Sheet1!J:J,A38) -> 1 | D38: =25-B38*10-C38*25 -> 0
A39: 王胡奕晗 | B39: =COUNTIF(Sheet1!I:I,A39) -> 1 | C39: =COUNTIF(Sheet1!J:J,A39) -> 0 | D39: =25-B39*10-C39*25 -> 15
A40: 朱紫菱 | B40: =COUNTIF(Sheet1!I:I,A40) -> 0 | C40: =COUNTIF(Sheet1!J:J,A40) -> 0 | D40: =25-B40*10-C40*25 -> 25
A41: 滕明高 | B41: =COUNTIF(Sheet1!I:I,A41) -> 0 | C41: =COUNTIF(Sheet1!J:J,A41) -> 1 | D41: =25-B41*10-C41*25 -> 0
A42: 徐宁优 | B42: =COUNTIF(Sheet1!I:I,A42) -> 0 | C42: =COUNTIF(Sheet1!J:J,A42) -> 1 | D42: =25-B42*10-C42*25 -> 0
A43: 黄镜谚 | B43: =COUNTIF(Sheet1!I:I,A43) -> 0 | C43: =COUNTIF(Sheet1!J:J,A43) -> 0 | D43: =25-B43*10-C43*25 -> 25
A44: 郑泽亮 | B44: =COUNTIF(Sheet1!I:I,A44) -> 0 | C44: =COUNTIF(Sheet1!J:J,A44) -> 1 | D44: =25-B44*10-C44*25 -> 0
A45: 滕紫涵 | B45: =COUNTIF(Sheet1!I:I,A45) -> 1 | C45: =COUNTIF(Sheet1!J:J,A45) -> 0 | D45: =25-B45*10-C45*25 -> 15
A46: 何方玥 | B46: =COUNTIF(Sheet1!I:I,A46) -> 0 | C46: =COUNTIF(Sheet1!J:J,A46) -> 1 | D46: =25-B46*10-C46*25 -> 0
A47: 王研可 | B47: =COUNTIF(Sheet1!I:I,A47) -> 0 | C47: =COUNTIF(Sheet1!J:J,A47) -> 1 | D47: =25-B47*10-C47*25 -> 0